{
  "tipoDocumento": "03",
  "clave": "50601102600310100010100100001030000000001130000001",
  "proveedorSistemas": "3101000999",
  "numeroConsecutivo": "00100001030000000001",
  "fechaEmision": "2026-10-01T10:00:00-06:00",
  "codigoActividadEmisor": "6201.0",
  "emisor": {
    "nombre": "SOLUCIONES DE SOFTWARE EJEMPLO S.A.",
    "identificacion": {
      "tipo": "02",
      "numero": "3101000101"
    },
    "nombreComercial": "Software Ejemplo",
    "ubicacion": {
      "provincia": "1",
      "canton": "01",
      "distrito": "08",
      "otrasSenas": "Avenida 10, edificio azul, piso 2"
    },
    "telefono": {
      "codigoPais": "506",
      "numTelefono": "22000101"
    },
    "correoElectronico": [
      "facturacion@software.example.com"
    ]
  },
  "receptor": {
    "nombre": "COMERCIALIZADORA CLIENTE EJEMPLO S.A.",
    "identificacion": {
      "tipo": "02",
      "numero": "3101000202"
    },
    "ubicacion": {
      "provincia": "4",
      "canton": "01",
      "distrito": "01",
      "otrasSenas": "100 metros norte del parque central"
    },
    "telefono": {
      "codigoPais": "506",
      "numTelefono": "22000202"
    },
    "correoElectronico": "cuentasporpagar@cliente.example.com"
  },
  "condicionVenta": "01",
  "detalleServicio": [
    {
      "codigoCABYS": "8314100000200",
      "cantidad": "1",
      "unidadMedida": "Sp",
      "detalle": "Capacitación de usuarios no impartida",
      "precioUnitario": "135000",
      "impuestos": [
        {
          "codigo": "01",
          "codigoTarifaIVA": "08"
        }
      ]
    }
  ],
  "resumenFactura": {
    "codigoTipoMoneda": {
      "codigoMoneda": "CRC"
    },
    "mediosPago": [
      {
        "tipoMedioPago": "04"
      }
    ]
  },
  "informacionReferencia": [
    {
      "tipoDocIR": "01",
      "numero": "50601102600310100010100100001010000000001110000001",
      "fechaEmisionIR": "2026-10-01T10:00:00-06:00",
      "codigo": "02",
      "razon": "Corrige monto: se elimina la capacitación"
    }
  ]
}
