{
  "tipoDocumento": "04",
  "clave": "50601102600310144444400100001040000000001112345678",
  "proveedorSistemas": "3101444444",
  "codigoActividadEmisor": "471101",
  "numeroConsecutivo": "00100001040000000001",
  "fechaEmision": "2026-10-01T11:00:00-06:00",
  "emisor": {
    "nombre": "SUPERMERCADO EJEMPLO S.A.",
    "identificacion": {
      "tipo": "02",
      "numero": "3101444444"
    },
    "nombreComercial": "Super Ejemplo",
    "ubicacion": {
      "provincia": "1",
      "canton": "01",
      "distrito": "01",
      "otrasSenas": "Calle 5, Avenida Central"
    },
    "telefono": {
      "codigoPais": "506",
      "numTelefono": "22334455"
    },
    "correoElectronico": [
      "caja@example.com"
    ]
  },
  "condicionVenta": "01",
  "detalleServicio": [
    {
      "numeroLinea": 1,
      "codigoCABYS": "2399901000000",
      "cantidad": "2",
      "unidadMedida": "Unid",
      "detalle": "Artículos varios de consumo de primera necesidad",
      "precioUnitario": "3500",
      "impuestos": [
        {
          "codigo": "01",
          "codigoTarifaIVA": "08"
        }
      ]
    }
  ],
  "resumenFactura": {
    "codigoTipoMoneda": {
      "codigoMoneda": "CRC",
      "tipoCambio": "1"
    },
    "mediosPago": [
      {
        "tipoMedioPago": "01"
      }
    ]
  }
}
